,summary,source_file
139,공보 이자료는 배포시부터 취급하여 주시기 바랍니다 출처 년 월 일 붙임 참조 통화정책방향 세계경제는 부진이 완화되는 흐름을 이어갔으나 및 국제금융시장에서는 코로나 재확산 우려로 상당폭 등락하였다 최근 앞으로 세계경제와 국제금융시 장은 코로나의 전개 상황 국내경제는 더딘 회복 흐름을 나타내었다 수출 부진이 완화되고 민간소비가 회복되었다 건설투자는 조정을 지속하였다 고용 상황은 큰 폭의 취업자 수 감소세가 이어지는 등 계속 부진하였다 앞으로 국내경제는 완만한 회복세를 나타낼 것으로 예상된다 성장경로의 불확실성 금년중 성장률은 지난 월 전망치 에 대체로 부합할 것으로 보인다 소비자물가 상승률은 기상여건 악화 등으로 크게 확대되면서 일반인 기대인플레 이션율은 대 중반에서 소폭 상승하였으며 율은 소비자물가 상승률과 근원인플레이션율 는 전망이 유력해 보인다 가계대 출은 증가세가 확대되었으며 주택가격은 수도권과 지방 모두에서 오름 세를 이어갔다 출처 한국은행에 유의 하여 통화정책을 운용해 나갈 것이며 를 것으로 통화정책의 완화기조는 유지 아울러재확산 정도 이 또한,2020_국문보도자료(2010).pdf
140,공보 이자료는 배포시부터 취급하여 주시기 바랍니다 출처 년 월 일 붙임 참조 통화정책방향 세계경제는 회복 흐름을 이어갔으나 코로나 재확산 코로나 재확산에 따른 위험회피 심리가 완화되었다 국제금융시장에서는 앞으로 세계경제와 국제금융시장은 국내경제는 완만하게 회복되는 모습을 나타내었다 민간소비와 건설투자가 회복 움직임을 나타내 었으며 수출은 개선 흐름을 고용 상황은 큰 폭의 취업자수 감소세가 이어지는 등 계속 부진 하였다 앞으로 성장경로의 불확실성은 높은 것으로 판단된다 향후 앞으로의 국내경제는 수출과 투자를 중심으 로 완만한 회복세를 성장률은 금년중 대 초반 내년에는 내외 수준을 나타낼 것 으로 예상된다 소비자물가 상승률은 공공서비스가격의 큰 폭 하락 등으로 대 초반 수준으로 낮아졌다 일반인 기대인플레이션율은 대 중반에서 소폭 마이 너스를 기록하였다 소비자물가 상승률과 근원인플레이션율 앞으로 금융시장은 경제시장 가계대출은 증가세가 확대되었으며 주택가격은 수도권 과 지방 모두에서 오름세를 지속하였다 금융통화위원회는 앞으로 성장세 회복을 지원하고 중기적 시계에서 물 가상승률 통화정책의 완화기조를 유지해 나갈 것이다 향후 이 과정에서향후 나는 아울러,2020_국문보도자료(2011).pdf
141,공보 이자료는 배포시부터 취급하여 주시기 바랍니다 출처 년 월 일 붙임 참조 통화정책방향 세계경제는 코로나 재확산의 영향으로 회복 흐름이 약화되었다 국제 금융시장에서는 코로나 재확산에도 불구하고 앞으로 세계경제와 국제금융시장은 코로나 의 재확산 정도 국내경제는 완만한 회복 흐름을 지속하였다 민간소비가 위축되고코로나 재확산 심화의 영향으로 회복 흐름을 이어갔다 고용 상황은 큰 폭의 취업 자수 감소세가 이어지는 등 계속 부진하였다 성장경로의 불확실성은 높은 것으로 판단된다 향후는 완만한 회복세를 나타낼 전망이다 금년중 성장률은 지난 월에 전망한 대로 내외 수준을 나타낼 것으로 예상된다 소비자물가 상승률과 근원인플레이션율식료품 및 에너지 제외 지수 일반인 기대인플레이션율은 대 후반을 유지하였다 금융시장에서는 장기시장금리는 상승하였다 가계대출은 높은 증가세를 이어갔으며 주택가격은 수도권과 지방 모두에서 오름세가 확대되었다 출처 한국은행에 유의 하여 통화정책을 운용해 나갈 것이며 통화정책의 완화기조를 유지해 나갈 것으로 향후그간의 정책대응,2021_국문보도자료(2101).pdf
142,공보 이자료는 배포시부터 취급하여 주시기 년 월 일 붙임 참조 통화정책방향 코로나 재확산에 따른 이동제한조치의 영향이 지속되면서 세계경제는를 국제금융시장에서는 백신접종 확대 등으로 세계경제와 국제금융시장은 코로 나의 재확산 정도 등에 영향받을 것으로 보인다 국내경제는 완만한 회복 흐름을 지속하였다 민간소비는 부진이 이어졌으나 수출은 호조를 지속하였다 고용 상황은 취업자수 가 큰 폭으로 감소하는 등 계속 부진하였다 앞으로는 지속될 것으로 판단된다 향후 국내경제전망 금년중 성장률은 지난 월에 전망한 대로 내외 수준을 나타낼 것으로 예상된다 는 일반인 기대인 플레이션율은 내외 수준으로 높아졌다 소비자물가 상승률를 상회하는 대 중후반을 근원인플레이션율은 금융시장에서는 주가는 경기회복 기대와 단기급등에 따른 경계감 이 함께 영향을 미치면서 상당폭 등락하였다 가계대출은 증가세가 확대되 였으며 주택가격도 높은 오름세를 지속하였다 출처 한국은행에 유의 하여 통화정책을 운용해 나갈 것이며 통화정책의 완화기조를 유지해 나갈 것으로 향후그간의 정책대응,2021_국문보도자료(2102).pdf
143,공보 이자료는 배포시부터 취급하여 주시기 호 붙임 참조 통화정책방향 세계경제는 주요국의 경기부양책 실시 백신 접종 확대 등으로 회복 흐 름이 강화되었다 국제금융시장에서는 경기회복 기대가 높아지면서 주 요국 주가와 국채금리가 상승하였다 코로나의 재확산 정도 백신 보급 상황 등에 영향 국내경제는 회복세가 다소 확대되었다 수출 민간소비는 부진이 완화되었다 고용 상황은 취업자수가 증가로 돌아서는 등 일부 개선 움직임을 나타내었다 회복속도와 관련한 불확실성은 높은 것으로 판단된다 앞으로 금년중 성장률은 지난 월에 전망했던 수준을 상회할 것으로 예상된다 소비자물가 상승률은 대 중반으로 낮아졌으며 근원인플레이션율식료품 일반인 기대인플레이 션율은 대 초반으로 높아졌다 며 소비자물가 상승률은 예상경로를 근원인플레이션율은 금융시장에서는 원달러 환율은 글로벌 달러화 강세 등으로 소폭 상승하였다 주택가격은 수도권과 지방 모두에서 높은 오름세를 출처 한국은행에 유의 하여 통화정책을 운용해 나갈 것이며 향후 통화정책의 완화기조를 유지해 나갈 것이다 국내경제는 점차 이 과정에서의 전개상황과 향후 정책방향 아울러 따라서,2021_국문보도자료(2104).pdf
144,년 월 일 공보 통화정책방향 금융통화위원회 결정시까지 한국은행 기준금리를 현 수준에서 유지하기로 하였음 붙임 최근는 주춤해졌으며 주식시장에서는 주가 오름세가 둔화되었다가 코로나의 재확산 정도 백신 보급 상황 등에 영향받을 것으로 보인다 앞으로 국내경제는 회복세가 확대되었다 수출이 호조를 고용 상황은 취업자수 증가폭이 확대되는 등 개선 움직 임을 이어갔다 앞으로 회복세가 강화될 것으로 전망된다 앞으로의 올해중 성장률은 내외 수준으로 예상된다 소비자물가 상승률은 대 초반으로 크게 높아졌으며 일반인 기대인플레이션율은 대 초반에서 소폭 높아졌다 는 것으로 전망된다 근원인플레이션율은 금융시장에서는 국내외 경기회복세 강화 등으로 장기시장금리가 상승하였으며 주가는 원달러 환율은 소폭 등락하였다 가계대출은 큰 폭의 증가세를 이어갔고 에 유의하 여 통화정책을 운용해 나갈 것이다 특히 통화정책의 완화기조를 유지해 나갈 것 이 과정에서의 전개 등을 면밀히 점검할 것이다,2021_국문보도자료(2105).pdf
145,공보 이자료는 배포시부터 취급하여 주시기 년 월 일 붙임 참조 통화정책방향 국제금융시장에서는 주가가 경기 회복세를 반영하 여 상승하고 장기 앞으로 세계경제와 국제금융시장은 코로나의 재확산 정도에 영향받을 것 국내경제는 양호한 회복세를 이어갔다 수출과 설비투자가 호조를 지속하고 민간소비도 회복 흐름을 나타내었다 고용 상황은 큰 폭의 취업자수 증가가 지속되는 등 개선세를 이어갔다 코로나 재확산으로 일시 주춤하겠으나 추경 집행 등으로 금년중 성장률은 지난 월에 전망한 대로 수준을 나타낼 것으로 예상된다 소비자물가 상승률은 일 반인 기대인플레이션율은 대 초중반으로 소폭 높아졌다 앞으로 소 비자물가 상승률은 당분간 대 중반 수준을 이어갈 근원인플레이션율은 점차 대 중반으로 높 아질 것으로 예상된다 금융시장에서는 국제금융시장 움직임 등에 영향받아 주가와 원달러 환율이 상승하였다 국고채금리는 년물이 상당폭 상승한 반면 년물 은 하락하였다 가계대출은 큰 폭의 증가세를 이어가 주택매매가격은 에 유의 하여 통화정책을 운용해 나갈 것이다 한국은행 물가가 당분간 높은 오름세를 이어갈 것으로 보이나 이 과정에서금융불균형 누적 위험 등을 면밀히 점검해 나갈 것이다 향후다만,2021_국문보도자료(2107).pdf
146,년 월 일 공보 통화정책방향 결정시까지 한국은행 기준금리를 상향 조정하기로 하였음 붙임 세계경제는 주요국의 백신 접종 확대 경제활동 제약 완화 등으로 회복 세를 이어갔다 금일 코로나 재확산 영향으로 주요국 국채금리가 하락하였다 코로나의 재확산 정도와 백신 보급 상황에 따라 국내경제는 양호한 회복세를 이어갔다 고용 상황은 취업자수 증가가 지속되는 등 개선세 를 이어갔다 앞으로 향후 국내경제는 수출과 투자가 호조를 지속하는 가운 금년중 성장률은 지난 월에 전망한 대로 수준을 나타낼 것으로 예상된다 소비자물가 상승률은 일 반인 기대인플레이션율은 대 중반으로 높아졌다 소비자물가 상승률은 월 전망치를 상회하는 대 초반으로 높아질 것 금융시장에서는 국내 코로나 재확산 등에 영향을 받아 주가가 하락하고 원달러 국고채 금리 는 장기물을 중심으로 하락하였다 주택가격은 수도권과 지방 모두에서 높은 오름세를 지속하였다 주택매매는 에 유의 하여 통화정책을 운용해 나갈 것이다 한국은행 코로나 관련 불확실성이 지속되고 국내경제가 이 과정에서 완화 정도의 추가 조정 시기는금융불균형 누적 위험,2021_국문보도자료(2108).pdf
147,공보 년 월 일 붙임 참조 통화정책방향 변이 바이러스 확산으로 세계경제가 회복 흐름을 이어갔다 최근 면서 주요국 증시가 큰 폭 상승하였다 이에 따라 국제금융시장에서는 앞으로 향후 세계경제와 국제금융시장은 코로나의 재확산 정도와 국내경제는 양호한 회복세를 이어갔다 수출코로나 재확산 영향으로 둔화되었던 민간소비도 다시 회복되는 모습을 나타내었다 고용 상황은 취업자수 증가가 지속되는 등 개선세를 이어갔다 백신 접종 및 그에 따른 경제활동 확대 등으로 점차 개선 앞으로 금년중 성장률은 지난 월에 전망한 대로 수준을 나타낼 것으로 예상된다 일반인 기대인플레이션율은 대 중반 수준을 지속하였다 소비자물가 상승률은 대체로 대 중반 수준을 나타내다가 가계대 출 증가규모는 높은 수준을 이어갔고 주택가격은 에 유의하 여 통화정책을 운용해 나갈 것이다 다만 국내경제가 양호한 성장세를 지속하고 완화 정도의 추가 조정 시기는글로벌 금융불균형 누적 위 험코로나 이 이러한 과정을 거쳐 가,2021_국문보도자료(2110).pdf
148,공보 이자료는 배포시부터 취급하여 주시기 년 월 일 통화정책방향 결정시까지 한국은행 기준금리를 상향 조정하기로 하였음 붙임 변이 바이러스 확산에도 세계경제 전망 변이 국제금융시장에서는 글로벌 인 플레이션 지속 우려에 영향받아 주가는 양호 한 기업 실적 등으로 선진국을 중심으로 상승하였다 앞으로 국내경제는 양호한 회복세를 지속하였다 민간소비 방역조치 완화에 힘입어 빠르게 회복되는 모습을 보여 고용 상황은 취업자수 증가가 지속되는 등 개선세를 이어갔다 앞으로앞 으로 국내경제는 수출과 투자가 양호한 흐름을 지속하는 가운데 민간소 비 회복세 강화될 것 성장률은 지난 월에 전망한 소비자물가 상승률은 석유류 가격 상승폭 확대 일반인 기대인플레이션율은 대 후반으로 높아졌다 소비자물가 전망경로 앞으로 금융시장에서는 국 고채 금리가 년물을 중심으로 상승하였다 주가는 주요국 주가 움직임 등에 영향받아 소폭 상승하였으며 원달러 환율은 하락하였다 가계대 출은 증가규모가 다소 축소되었으며 주택가격은 에 유의하 여 통화정책을 운용해 나갈 것이다 다만 통화정책의 완화 정도를 적절히 조을 상회할 것으로 이 과정에서 이와 함께,2021_국문보도자료(2111).pdf
149,공보 이자료는 배포시부터 취급하여 주시기 바랍니다 출처 년 월 일 통화정책방향 결정시까지 한국은행 기준금리를 상향 조정하기로 하였음 제 최근 세계경제는 변이 바이러스 확산에도 백신 접종 확대 등으로 회복 흐름을 이어 국제금융시장에서는 코로나 전개 상황 및 주요국 통화정책에 대한 기대 변화 앞으로 세계경제와 국제금융시장은 코로나 전개 상황 국내경제는 코로나 재확산에도 회복세를 지속하였다 민간소비의 회복주춤하였으나 수출은 견조한 글로벌 수요에 힘입어 호조를 지속하였다 설비투자는 글로벌 공급차질에 영향받아 다소 조정되었다 고용 상황은 취업자수 증가세가 이어지는 등 개선세를 지속하 였다 앞으로을 이어갈 것으로 전망된다 향후 국내경제는 수출의 견실한 증가세가 이어지고 민간소비 회복흐름이 재개되면서 양호한 성장세를 지속할 금년중 성장률은 지난 월에 전망한 대로 수준을 나타낼 것으로 예상된다 소비자물가 상승률 추이 및일반인 기대인플레이션율은 대 초반 수준을는 결과를 나타내었다 소비자물가 상승률 전망경로를 크게 상회할 것으로 보이며 연간으로는 대 근원인플레이션율도 금년중 를 상당폭 상회할 것으로 보인다 금융시장에서는 장기시장금리가 코로나 재확산 우려로 하락하였다 현재달러 환율은 미 연준 통화정책 정상화 가속 전망반락하였으며 주가는 소폭 하락하였다 반등하였다 가계대출은 증가규모가 축소되었으며 주택가 격는 증가세가 에 유의 하여 통화정책을 운용해 나갈 것이다 한국은행 통화정책의 완화 정도를 적절히 조정해 나갈 것이다 향후 완화 정도의 추가 조정 시기는는 주요국 통화정책 변화금융불균형 누적 위험 이 과정에서 그러나,2022_국문보도자료(2201).pdf
150,공보 이자료는 배포시부터 취급하여 주시기 바랍니다 년 월 일 붙임 참조 통화정책방향 변이 바이러스 확산에 세계경제가 크게 위축되지 않았다 는 속도에 대한 우려 우크라이나 사태 등의 영향으로 코로나 전개 상 황 앞으로 세계경제와 국제금융시장은 코로나 국내경제는 코로나 재확산에도 회복세를 지속하였다 민간소비는한 방역조치 강화 등으로 주춤하였고 설비투자는 글로벌 공급차질에 영향 받아 다소 조정되었다 고용 상황은 취업자수 증가세가 이어지는 등 개 선세를 지속하였다 앞으로 향후 국내경제는 수출의 견실한 증가세가 이어지 고 민간소비 회복 흐름이 점차 재개되면서 양호한 성장세를 지속할 것 는 지난 월 전망치를 크게 벗어나지 않을 것으로 예상된다 소비자물가 상승률은 석유류 및 일반인 기대인플레이션율은 대 중후반 수준을 나타내었다 소비자물가 상승률이 를 상회할 것으로 보인다 앞으로 근원인플레이션율도 금년중 대 중반 수준으로 높아질 것 으로 보인다 금일 가계대출은 증가규모가 축소되었다 주택가격은 에 유의 하여 통화정책을 운용해 나갈 것이다 한국은행 통화정책의 완화 정도를 적절히 조정해 나갈 것이다 향후 완화 정도의 추가 조정 시기는 이 과정에서금리 인상에 대한 파급 효과 주요국의 통화정책 변화,2022_국문보도자료(2202).pdf
151,공보 이자료는 배포시부터 취급하여 주시기 바랍니다 년 월 일 통화정책방향 년 월 일금리를 상향 조정하기로 하였음 붙임 참조 제 목 세계경제 국제금융시장에서는 미 연준의 통화정책 정상화 속도에 대한 기대 변화 주가는 상당폭 하락하였다가 반등하였다 코로나 전개 상황 지정학적 리스크 등에 영향을 받을 것으로 예상된다 국내경제는 회복세를 이어갔다 소비가 다소 개선되는 모습을 보여 고용 상황은 큰 폭의 취업자수 증가가 이어지는 등 개선세를 지속 하였다 앞으로 국내경제는 우크라이나 사태 등에 일부 영향받겠지만 금년중 성장률은 지난 월 전망치를 다소 하회할 것으로 예상된다 소비자물가 상승률은 석유류 가격의 오름세 확대 공업제품 및 기대인플레이션율 대 후반으로 상승 소비자물가 전망 및 인상률 월 전망치 상회 근원인플레이션율도 상당기간 내외 수준을 지속 할 것으로 보인다 금융시장에서는 주가는 상당폭 등락하였고 가계대출은 소 폭 감소하고 주택가격은 수도권을 중심으로 소폭 하락하였다 통화정책을 운용해 나갈 것이며 이와 관련하여 금융안정에 유의하여 통화정책의 완화 정도를 적절히 조정해 나갈 것 완화 정도의 추가 조정 시기는 이 과정에서 금융불균형 누적 위험 주요국 통화정책 변화 등을 코로나 확산 상 황 금융중개지원대출 금리 유지 및 일부 조정,2022_국문보도자료(2204).pdf
152,공보 년 월 일 월일부터 한국은행 기준금리를 인상하기로 하였음 붙임 참조 국제금융시장에는 미 달러화가 상당폭 강세를 나타내 주 요국 국채금리가 상승하고 주 가는 위험회피심리가 강화되면서 큰 폭 하락하였다 는 글로벌 인플레이션 움직임 앞으로 세계경제와 국제금융시장은 국내경제는 회복세를 이어갔다 고용 상황은 큰 폭의 취업자수 증 가가 이어지는 등 개선세를 지속하였다 앞으로 향후 국내경제는를 지속할 것으로 보인다 금년중 성장률은 지난 월 전망치를 다소 하회하는 소비자물가 상승률은 대 후반으로 크게 높아졌다 기대인플레이션율과 소비자물가 상회하는 대 중반을 나타낼 것으로 전망되는 금년중 근원인플레이션율은 대 초반으로 높아질 것으로 전망된다 금융시장에서는 미 연준의 정책금리 인상 가속 중국 경기둔화 우려 등으로 주가는 가계대출은 소폭 증가로 전환하였고 주택가 격은 보합세를 나타내었다 에 유의 하여 통화정책을 운용해 나갈 것이다 한국은행 대내외 여건의 불확실성이 상존 완화 정도의 추가 조정시기는 글로벌 금융불균형 누적 위험 주요국정책 변화 지정학적 리스크 등을 면밀히 점검하고,2022_국문보도자료(2205).pdf
153,공보 년 월 일 이자료는 배포시부터 취급하여 주시기 금융통화위원회는 기준금리를 상향 조정하기로 하였음 붙임 참조 고물가 상황 고착을 막기 위한 선제적 정책 대응이 더욱 중요 최근 주요국 금리 인상 가속화 우려로 위험회피심리 강화 주요국 주가가 상당폭 하락하고 글로벌 국채금리는 큰 폭으로 등락하였다 미 달러화가 강세를 지속하고 약세를 는 세계경제와 국제금융시장이 어떻게 변화할 것인가 앞으로 다가올 코로나 국내경제는 회복세를 이어갔다 민간소비가 회복세를 지속하였으며 설비투자는 부진이 완화되는 모 습을 나타내었다 고용 상황은 큰 폭의 취업자수 증가가 이어지는 등 개선세를 지속하였다 성장률이 를 하회할 것으로 전망된다 수출도 둔화되고 있다 소비자물가 상승률은 기대인플레이션율은 모두 에 근접하는 수준으로 상승하였다 소비자물가는 당분간 상승세를 이어갈 것으로 보인다 근원인플레이션율도 상당 기간 이상의 높은 수준을 지속할 것으로 보인다 주식시장에서는하였으며 금융시장 원달러 환율은 글로벌 미 달러화 강세에 영향받아 큰 폭 상승하 였다 가계대출은 소폭 증가하고 주택가격은 보합세를 나타내었다 물가와 경기 상황을 이같은 물가동향을 종합해볼 때 향후 금융통화위원회는 성장세를 점검하면서 물가안정에 유의 하고 물가가 상당기간 목표 수준을 상회할 것으로 예상되므로 금리인상 기조를 이어나갈 필요가 이 과정에서향후 금리인상의 방향과 속도는 앞으로,2022_국문보도자료(2207).pdf
154,공보 이자료는 배포시부터 취급하여 주시기 바랍니다 년 월 일 년 월 일 금융통화위원회는 다음과 같이 결정하였음 하기로 국내외 경기 하방위험이 증대되었고 세계경제는 우크라이나 사태 장기화 주요 선진국의 정책금리 큰 폭 인상 국제금융시장에서는 미 연준의 금리인상 속도에 대한 기대 변화 등으로 앞으로 향후 세계경제와 국제금융시장 지정학적 리스크 등에 영향을 받을 것 국내경제는 소비가 회복세를 이어갔지만 주요국의 성장세 약화로 수출이 둔화됐다 고용 상황은 큰 폭의 취업자수 증 가가 이어지는 등 개선세를 지속하였다 성장률이 지난 월 전망치를 상회하는 또한 소비자물가 동향 인플레이션율은 대 중반 기대인플레이션률은 물가 및 에너지 제외 지수은 소비자물가 상승률 전망 금년 및 내년 금융시장에서는 글로벌 금융시장 움직임 등에 영향받아 변동성이 확대되 었다 장기시장금리가 상당폭 하락한 후 반등하였다 의 영향으로 크게 높아졌다 미 가계대출은 소폭 감소하고 주택 가격은 하락세로 전환하였다 금융통화위원회는 앞으로 성장세를 면밀히 점검하면서 물가가 목표수준을 상회하는 오름세를 지속할 것으로 예상된다 는 이 과정에서 향후 금리인상의 방향과 속도는 금융중개지 원대출 한시 프로그램,2022_국문보도자료(2208).pdf
155,공보 이자료는 배포시부터 취급하여 주시기 바랍니다 년 월 일 년 월 일금리를 연 에서 로 상향 조정하기로 하였음 정책대응의 강도를 높이다 물가 오름세가 지속되는 가운데을 강화할 필요가 있다고 판단하였다 세계경제는 경기 둔화가 지속됐다 현재 국제금융시장에서는 미 달러화 강세 기조 강화로 앞으로 세계경제와 국제금융시장은 지 정학적 리스크 및 고용 상황은 큰 폭의 취업자수 증가가 이어지는 등 개선세를 지속하였다 성장세가 점차 낮아질 것으로 예상된다 앞으로 성장률은 지난 월 전망치에 대체로 부합 월 소비자물가는 석유류 가격 오름세 둔화에도 개인서비스 및 가공식품 인플레이션율 및 기대인플레이션율이 대의 높은 수준을 이어갔다단위 소비자물가 소비자물가는 환율 상승의 영향 등이 추가 물가 상승압력으로 작용를 지속할 것으 로 예상된다 향후 소비자물가 상승률 전망 및 내년 예상치 금융시장에서는 미 달러화 강세와 엔화 약세 등에 영향받아 환율이 크게 상승하고 외국인 증권투자자금 장기시장금리는 큰 폭 상승하였고 주가는 크게 하락하였다 가계대출은 소폭 감소하고 주택가격은 하락폭이 확대되었다 금융통화위원회는 앞으로 성장세를 면밀히 점검하면서 국내 경기가 둔화되고 있으나기조를 유지할 필요는 있다 이 과정에서금리인상의 방향과 속도 지정학적 리스크 등을 면밀히 검토해 이를 통해 향후 이와 관련,2022_국문보도자료(2210).pdf
